Type,Sentence
train,"TECHNICAL SKILLS Programming Languages Java Servlet JSP Spring Boot Web Technology HTML5 CSS3 Bootstrap JavaScript JQuery Ajax AngularJs Database MySQL IDE and Tool Eclipse spring tool Suit Net beans Sublime Text Atom operating-system Windows XP 7 8 10 ACHIEVEMENT Java Developer Certificate from Unanth Technical Institute Java Certificate from solo Learn Command line crash Course certificate from Udemy JOB DETAILS Education Details January 2018 M C A Pune Maharashtra Pune University January 2015 B C A Amravati Maharashtra Amravati University January 2012 H S C Amravati Maharashtra Amravati University January 2010 S S C Amravati Maharashtra Amravati University Java developer Full Stack Java Developer Skill Details Css Exprience Less than 1 year months Ajax Exprience Less than 1 year months Servlet Exprience Less than 1 year months Html5 Exprience Less than 1 year months Spring Exprience Less than 1 year months Java Exprience Less than 1 year months Jquery Exprience Less than 1 year months Jsp Exprience Less than 1 year months Javascript Exprience Less than 1 year months Bootstrap Exprience Less than 1 year months Spring Boot Exprience Less than 1 year monthsCompany Details company Salcluster technologies description Worked as java developer Developed 3 projects using java servlet jsp ajax and web technologies company Salcluster Technologies LLP description Technology Core Java Servlet and JSP HTML5 CSS3 Bootstrap Javascript Jquery Ajax and Bootstrap PROJECT DETAILS Title GST And Sales Billing Softwares Status Completed Duration 1 5 Months Abstract This is a web-application made by using Java Servlet and JSP JavaScript Jquery Ajax and MySQL on back end It is a client s website which is used for Billing It includes GST Billing Generate and print invoice It has five master pages and four common pages Masters include customer master item master uom master setup master reason master and common pages like sales order payments sales return and invoice Title Dinman News website Status Completed Duration 1 Months Abstract This is a Website project by using Java Servlet and JSP JavaScript Jquery Ajax and MySQL on back end It is a clients website It is used for displaying online video and text news Title Agri Management Website Status Completed Duration 1 5 Months Abstract This is a Website project by using Java Servlet and JSP JavaScript Jquery Ajax and MySQL on back end It is used for purchasing and selling vegetables all over india company OmegaSoft Technologies pvt ltd description Company Name OmegaSoft Technologies pvt ltd An ISO certified Company Duration 5 months Technology Java Spring Hibernate AngularJs Ajax KendoUI and BootStrap Architecture MVC Architecture and Service based Programming Project Module Login Registration and Role Assignment Payments INTERNSHIP PROJECT DETAILS Title Employment Times Status Completed Duration 4 Months Abstract This is a Website project using Java Spring Hibernate Angular Js Ajax and MySQL on back end It is a client s website which is used for posting of newspapers all over India It has 12 Modules In which it has Admin Panel E paper Posting Subscriptions and many more It is a very light weight website built by using MVC Architecture and Service based Architecture We can also post advertisements on website and share the news on Facebook or any other social media directly It has Payment module and users are able to make payments online through debit or credit card or E Wallet "
train,"SKILLS 1 Team leading 2 Self motivated 3 Hard working Strengths Ready to learn new Programming Languages Punctual Discipline Respectfulness DECLARATION I hereby inform you that all the statement made above are true with the best of my knowledge and belief Education Details August 2014 to July 2017 MCA Computer Sciene Amravati Maharashtra SGBAU Amaravti Java Web Developer Skill Details Core Java JSP Servlet Spring Hibernate Struts Javascript Exprience 6 monthsCompany Details company Salcluster Technologies description 1 I am Java web developer 2 Jsp servlet Sprinng MVC Technologies"
train,"Skills Language Java operating-system Windows Linux CentOS 6 6 Databases Oracle mySql and Derby Embedded DB IDE Eclipse Oxygen Tools SonarQube Putty Responsibilities Participated in requirements gathering and design development meetings Reviewed code and debugged errors to improve performance Coordinated with systems partners to finalize designs and confirm requirements Consistently met deadlines and requirements for all production work orders Collaborated with other developers to identify and alleviate the number of bugs in the software and provided maintenance and development of bug fixes and patch sets for existing applications Education Details Bachelor of Engineering Computer Savitribai Phule Pune University Java Developer Java Developer Aurus Tech Pvt Ltd Skill Details JAVA Exprience 32 months LINUX Exprience 6 months Adavance Java Exprience Less than 1 year months Derby Exprience Less than 1 year months Oracle Exprience Less than 1 year monthsCompany Details company Aurus Tech Pvt Ltd description Having 2 years of experience in working with a Payment Gateway Solutions provider with Core Java Hardworking Java Developer enthusiastic about working with multicultural teams company Aurus Tech Pvt Ltd description Participated in requirements gathering and design development meetings Reviewed code and debugged errors to improve performance Coordinated with systems partners to finalize designs and confirm requirements Consistently met deadlines and requirements for all production work orders Collaborated with other developers to identify and alleviate the number of bugs in the software and provided continued maintenance and development of bug fixes and patch sets for existing applications "
train,"CORE COMPETENCIES Ant Maven GIT Bitbucket Jenkins Linux Ansible shell-scripting Requirement Gathering Continuous-Integration and Continuous-Deployment Software Development Life Cycle Software Testing Life Cycle Documentation Reporting Test Reports IT SKILLS Primary Skills Dev-ops methodologies Programming Languages C Core Java Version Controls GIT Bitbucket Build Tools ANT Maven CI CD Tools Jenkins Configuration management Ansible Scripting shell-script Application Servers apache-tomcat serverEducation Details June 2015 to June 2017 Masters of science information-technology Hyderabad Telangana JNTU devops-engineer devops-engineer Nendrasys Technologies Pvt Ltd Skill Details DEPLOYMENT Exprience 27 months Git Exprience 27 months DOCUMENTATION Exprience 26 months CHANGE MANAGEMENT Exprience 10 months CONFIGURATION MANAGEMENT Exprience 10 monthsCompany Details company Nendrasys Technologies Pvt Ltd description Date Project Description The Scope of the project is to design develop e commerce product features for sloan project It s a basically B2B project where customer can buy all fixers sinks related product It focuses on the company the stakeholders and applications which allow for online sales distribution and marketing of product Responsibilities o Detailed technical Knowledge and hands on experience on DevOps Automation Build Engineering and Configura tion Management o Creating fully automated CI build and deployment infrastructure and processes for multiple projects o Developing scripts for build deployment maintenance and related tasks using Jenkins o Installing configuring and maintaining Continuous Integration Automation and Configuration Management tools o Developing Ant Maven and shell-scripts to automatically compile package deploy WAR EAR and JAR files of mul tiple applications to various platforms o Creating Repositories branches managing the permissions of users and maintaining GIT Bitbucket o Deploying and maintaining the code and application respectively and configuring the components which increase the re usability o Working closely with Architecture Development Test Security and IT Services teams o Supporting Business Analysts in getting used to the newly created jobs and Release activities o Communicating daily with On Site Team o Analyzing the requirements and identifying gaps tracking logs issues PROJECT 2 Nendrasys Technologies Pvt Ltd Project Name Bangkok Bank Limited BBL Thaitrade Commercial E commerce Payment portal company Nendrasys Technologies Pvt Ltd description Role devops-engineer devops-engineer for a team that involved different development teams and multiple simultaneous software re leases Participated in weekly release meetings with different teams to identify and mitigate potential risks associated with the releases Responsible for Creating Repositories branches managing the permissions of users and maintaining GIT Creating fully automated CI build and deployment infrastructure and processes for multiple projects Analyze and resolve conflicts related to merging of source code for GIT Responsible for creating Ant and Maven scripts for build automation Implemented the setup for Master slave architecture to improve the Performance of Jenkins Handled end to end deployments and code propagation s across different environments DEV to PROD Handled the tasks of developing and maintaining the Change Tasks Closely working with Developers QA Performance UAT testers IT Team Created and maintained documentation of build and release processes and application configuration Coordinated with developers Business Analyst and Mangers to make sure that code is deployed in the Production environment PROJECT 1 Nendrasys Technologies Pvt Ltd Project Name Sloan Global Holdings Sloan E commerce company Nendrasys Technologies Pvt Ltd description Project Description BBL is development of an e commerce payment portal System As such BBL require a system which can support multiple merchants B2B B2C e commerce portal with various payment options via both online and offline To achieve this BBL had made an agreement with Thai Trade Thai Trade is one of the leading e commerce website recognized by Thai government In present Thai trade has a good base of users and sellers in several categories The scope of the project is to design and develop e commerce product features for BBLWTP project It focuses on the company the stakeholders and applications which allow for online sales distribution and marketing of electronics Responsibilities o Plan and track activities involved for build and deployment o Resolving build issues o Developing scripts for build deployment maintenance and related tasks using Jenkins o Collaboration with Development QA Product managements on build plans schedules o Send daily and weekly reports to the team o Involved in creating repositories branches merging activities backup and restore activities in subversion servers o Maintenance of Maven shell-scripts for safe builds and deploys "
validate,"Wanted: Java Engineer with experience in building high-performing, scalable, enterprise-grade applications."
validate,"You need to have proven knowledge in Web applications with JEE/Spring, DevOps experience with high focus on cloud-based operating-systems (particularly AWS), Jenkins, Docker and Kubernetes are a plus."
validate,"Looking for people with experience in Kafka, Big-Data and Python."
validate,"Must have experience with build tools (Maven, Gradle) and a Object-Oriented Analysis and design using common design patterns."
validate,"Hiring people with good knowledge of Relational Databases, PostgreSQL and ORM technologies (JPA, Hibernate)."
validate,"Orientation towards test-driven development and clean-code is a plus"
validate,"Requirements: experience with version control systems (Git) and a Bachelor/Master degree in Computer Science, Engineering, or a related subject."
validate,"You need to have development experience in Java and Java frameworks and SQL/Relational Databases skills."
validate,"One requirement is having practical skills in CI/CD - some of Git, Maven, Gradle, Docker, Jenkins, Jira."
validate,"Skills description: 4+ years’ experience with Java (developing backend/web-applications, Java 8+), 3+ years’ experience with Spring Boot (Spring Data, Spring Cloud), good unit/integration testing experience."
validate,"Nice-to-Have Skills: experience with software provisioning/configuration (e.g. Puppet, Ansible), with Oracle  and Angular 2+."
validate,"We are looking for: experience in Apache Camel, experience with MSSQL, PostgreSQL, experience with Unit and integration testing with JUnit and Mockito, CI/CD tools: Git, Jenkins, Maven, SonarQube, Artifactory and Microservices, Dockers, and Kubernetes."
validate,"Nice to have: exposure to NoSQL databases (MongoDB), exposure to Python, Jupyter Hub."
validate,"Requirements: strong knowledge of Java Fundamentals and OOP principles and good understanding of design patterns."
validate,"At the moment we're using a mix of Python and Javascript."
validate,"We know you want to know so here is the stack: Python, Django, React, Redux, Express."
validate,"Other buzzwords: Universal Web Apps, Machine Learning, Heroku, AWS, Algolia."
validate,"Have already used at least one of these technologies amongst JavaScript, TypeScript, React, Vue.js, Kafka, ElasticSearch, MongoDB, and Python."
validate,"The general tech stack of the project is: iOS (Swift), Android (Kotlin), Modern Web Apps (Angular, React), Microservice architecture with OpenAPI contracts."
validate,"Basic qualifications: experience with web-application development (.NET/JavaScript or equivalent)."
validate,"Open to work with other programming languages (Python, Scala)."
validate,"Qualifications and Experience: Knowledge of Spring (Boot, Data, Security)."
validate,"University degree in a technical subject (Computer Science, Mathematics, or similar) or equivalent experience in the industry."
validate,"Qualifications: FPGA Digital Design experience, C++, Qt framework experience"
validate,"The purpose of this career summary is to explain your qualifications for the job in 3-5 sentences and convince the manager to read the whole resume document."
validate,"The requirements are the following: knowledge of .Net, .Net Core, WebAPI, ASP.Net MVC, Razor Views or equivalent single page application framework, C#, JavaScript, CSS, HTML5 & Azure Cloud services or AWS, Active Directory."
validate,"You need to have experience with the ASP.NET framework and ideally SQL Server."
validate,"Capability to design complex SQL queries."
validate,"You know the ins and outs of several cloud providers like AWS, Azure, Heroku and profound experience in Terraform, Google Cloud."
validate,"Here are the technologies you must have experience with: Django, Node.js, Nginx, React, React Native, Redis, RabbitMQ."
validate,"The following are a must: Selenium, Grafana."
validate,"Works with the customer to further define requirements and to resolve issues in case of need."
validate,"We strive for excellence and we aim to win as a team."
validate,"You can expect a career full of brilliant possibilities."
validate,"Looking to built the most amazing Data Academy, having 5 open Intern positions with the possibility of hiring afterwards."
validate,"Our office is located in central Timisoara with lots of shops and restaurants just around the corner."
validate,"I think playing sports when you are young is essential as it builds the team spirit."
validate,"At Stack Intellect, implemented demand forecasting models improving forecast accuracy by 34%."
validate,"Developed customer segmentation algorithm in R leading to 22% increase in market share."
validate,"Cut customer complaints by 50% for an SaaS application."
validate,"At Shellnac Inc., used Jenkins and AWS tools to slash release times by 20%."
validate,"Freed up 50 hrs/mo at PinkSky Tech through back-end automation."
validate,"Designed a restaurant inventory application that saved the company $400/month in labor costs."
validate,"SQL Developer Skills: Oracle, Database Architecture, SSIS, PL/SQL, Security, Common Table Expressions, Creating Reports, Interpersonal Skills, Collaboration, Communication."
validate,"Developed software components in JavaScript based on functional requirements and specifications."
validate,"Wrote technical documentation to support the maintenance team."
validate,"Adapted front-end technologies to follow back end development using Angular."
validate,"Key achievement: Performed debugging on a critical error that saved the company over $54,000 of potential lost revenue in downtime."
validate,"Skills: Data Structures, Open Source Software, Cloud Computing Services (AWS), Ruby on Rails, Git Version Control, Teamwork Skills."
validate,"Active contributor to over 10 GitHub libraries."
validate,"Developed a marketing lead MySQL database, collecting, categorizing, and filtering leads from various stakeholders, i.e., www, social media channels, or newsletters."